{
  "request_id": "223e4567-e89b-42d3-a456-426614174000",
  "client_build": "1.0.0+123",
  "schema_version": "scene-script-v1",
  "locale": "ru",
  "script_text": "СЦЕНА 🎬\nМАРИНА подходит к столу.\n",
  "marked_objects": [
    {
      "id": "deadbeef",
      "name": "стол",
      "aliases": ["столик"]
    }
  ],
  "scene_boundaries": [
    {
      "id": "scene_1",
      "start": 0,
      "end": 16,
      "heading": "СЦЕНА 🎬"
    },
    {
      "id": "scene_2",
      "start": 16,
      "end": 61,
      "heading": "МАРИНА подходит к столу"
    }
  ],
  "constraints": {
    "maximum_scenes": 20,
    "allow_clarification": true
  },
  "previous_job_id": null,
  "consent_version": "scene-processing-v1"
}
